"Status","Start Time","Stop Time","Duration in ms","Parent Suite","Suite","Sub Suite","Test Class","Test Method","Name","Description"
"failed","Tue Mar 05 07:44:21 UTC 2024","Tue Mar 05 07:44:21 UTC 2024","15","Smoke tests","","","","","MongoDB database creation with three collections [""counters"", ""transforms"", ""writers""] via API",""
"failed","Tue Mar 05 07:44:21 UTC 2024","Tue Mar 05 07:44:21 UTC 2024","16","Full regression","","","","","MongoDB database and collection creation via Kafka",""
"failed","Tue Mar 05 07:44:21 UTC 2024","Tue Mar 05 07:44:21 UTC 2024","15","Full regression","","","","","MongoDB database and collection creation via API",""
"failed","Tue Mar 05 07:44:21 UTC 2024","Tue Mar 05 07:44:21 UTC 2024","16","Full regression","","","","","Summarize Monthly Usage Data: Adding data to MongoDB collections",""
"failed","Tue Mar 05 07:44:21 UTC 2024","Tue Mar 05 07:44:21 UTC 2024","14","Smoke tests","","","","","MongoDB database creation with three collections [""collection1"", ""collection2"", ""collection3""] via API",""
