"Status","Start Time","Stop Time","Duration in ms","Parent Suite","Suite","Sub Suite","Test Class","Test Method","Name","Description"
"passed","Tue Feb 06 15:42:53 UTC 2024","Tue Feb 06 15:43:27 UTC 2024","33293","Smoke tests","","","","","should create MongoDB database and three collections via API","This test checks MongoDB database and three collections creation"
"passed","Tue Feb 06 15:42:53 UTC 2024","Tue Feb 06 15:43:04 UTC 2024","11211","Full regression","","","","","should create MongoDB database and collection via direct sending event to Kafka","This test checks MongoDB database and collection creation"
"passed","Tue Feb 06 15:42:53 UTC 2024","Tue Feb 06 15:43:27 UTC 2024","33283","Smoke tests","","","","","should create MongoDB database and three collections via API","This test checks MongoDB database and three collections creation"
"passed","Tue Feb 06 15:42:53 UTC 2024","Tue Feb 06 15:43:04 UTC 2024","11210","Full regression","","","","","should create MongoDB database and collection via API","This test checks MongoDB database and collection creation"
"passed","Tue Feb 06 15:42:53 UTC 2024","Tue Feb 06 15:43:27 UTC 2024","33293","Full regression","","","","","should add data to MongoDB collections via API","This test checks MongoDB database and three collections creation"
