"Status","Start Time","Stop Time","Duration in ms","Parent Suite","Suite","Sub Suite","Test Class","Test Method","Name","Description"
"passed","Fri Mar 08 13:54:31 UTC 2024","Fri Mar 08 13:55:04 UTC 2024","33314","Smoke tests","","","","","should create MongoDB database and three collections via API","This test checks MongoDB database and three collections creation"
"failed","Fri Mar 08 13:54:31 UTC 2024","Fri Mar 08 13:55:21 UTC 2024","50408","Full regression","","","","","Summarize Monthly Usage Data: Adding data to MongoDB collections","This test checks adding data to MongoDB collections"
"passed","Fri Mar 08 13:54:31 UTC 2024","Fri Mar 08 13:54:42 UTC 2024","11206","Full regression","","","","","should create MongoDB database and collection via direct sending event to Kafka","This test checks MongoDB database and collection creation"
"passed","Fri Mar 08 13:54:31 UTC 2024","Fri Mar 08 13:55:04 UTC 2024","33326","Smoke tests","","","","","should create MongoDB database and three collections via API","This test checks MongoDB database and three collections creation"
"passed","Fri Mar 08 13:54:31 UTC 2024","Fri Mar 08 13:54:42 UTC 2024","11204","Full regression","","","","","should create MongoDB database and collection via API","This test checks MongoDB database and collection creation"
