"Status","Start Time","Stop Time","Duration in ms","Parent Suite","Suite","Sub Suite","Test Class","Test Method","Name","Description"
"passed","Tue Feb 06 14:49:55 UTC 2024","Tue Feb 06 14:50:29 UTC 2024","33346","","","","","","should add data to MongoDB collections via API","This test checks MongoDB database and three collections creation"
"failed","Tue Feb 06 14:49:55 UTC 2024","Tue Feb 06 14:50:29 UTC 2024","33344","","","","","","should create MongoDB database and three collections via API","This test checks MongoDB database and three collections creation"
"passed","Tue Feb 06 14:49:55 UTC 2024","Tue Feb 06 14:50:29 UTC 2024","33343","","","","","","should create MongoDB database and three collections via API","This test checks MongoDB database and three collections creation"
"passed","Tue Feb 06 14:49:55 UTC 2024","Tue Feb 06 14:50:06 UTC 2024","11179","","","","","","should create MongoDB database and collection via direct sending event to Kafka","This test checks MongoDB database and collection creation"
"passed","Tue Feb 06 14:49:55 UTC 2024","Tue Feb 06 14:50:06 UTC 2024","11179","","","","","","should create MongoDB database and collection via API","This test checks MongoDB database and collection creation"
