"Status","Start Time","Stop Time","Duration in ms","Parent Suite","Suite","Sub Suite","Test Class","Test Method","Name","Description"
"failed","Mon Mar 04 14:40:49 UTC 2024","Mon Mar 04 14:40:59 UTC 2024","10322","Smoke tests","","","","","should create MongoDB database and three collections via API","This test checks MongoDB database and three collections creation"
"failed","Mon Mar 04 14:40:49 UTC 2024","Mon Mar 04 14:40:59 UTC 2024","10232","Full regression","","","","","should create MongoDB database and collection via direct sending event to Kafka","This test checks MongoDB database and collection creation"
"failed","Mon Mar 04 14:40:49 UTC 2024","Mon Mar 04 14:40:59 UTC 2024","10325","Full regression","","","","","Summarize Monthly Usage Data: Adding data to MongoDB collections","This test checks adding data to MongoDB collections"
"failed","Mon Mar 04 14:40:49 UTC 2024","Mon Mar 04 14:40:59 UTC 2024","10294","Smoke tests","","","","","should create MongoDB database and three collections via API","This test checks MongoDB database and three collections creation"
"failed","Mon Mar 04 14:40:49 UTC 2024","Mon Mar 04 14:40:59 UTC 2024","10222","Full regression","","","","","should create MongoDB database and collection via API","This test checks MongoDB database and collection creation"
