"Status","Start Time","Stop Time","Duration in ms","Parent Suite","Suite","Sub Suite","Test Class","Test Method","Name","Description"
"failed","Mon Mar 04 15:00:15 UTC 2024","Mon Mar 04 15:01:05 UTC 2024","50337","Full regression","","","","","Summarize Monthly Usage Data: Adding data to MongoDB collections","This test checks adding data to MongoDB collections"
"passed","Mon Mar 04 15:00:15 UTC 2024","Mon Mar 04 15:00:26 UTC 2024","11215","Full regression","","","","","should create MongoDB database and collection via direct sending event to Kafka","This test checks MongoDB database and collection creation"
"passed","Mon Mar 04 15:00:15 UTC 2024","Mon Mar 04 15:00:26 UTC 2024","11215","Full regression","","","","","should create MongoDB database and collection via API","This test checks MongoDB database and collection creation"
"passed","Mon Mar 04 15:00:15 UTC 2024","Mon Mar 04 15:00:48 UTC 2024","33337","Smoke tests","","","","","should create MongoDB database and three collections via API","This test checks MongoDB database and three collections creation"
"passed","Mon Mar 04 15:00:15 UTC 2024","Mon Mar 04 15:00:48 UTC 2024","33345","Smoke tests","","","","","should create MongoDB database and three collections via API","This test checks MongoDB database and three collections creation"
