"Status","Start Time","Stop Time","Duration in ms","Parent Suite","Suite","Sub Suite","Test Class","Test Method","Name","Description"
"failed","Fri Feb 09 22:35:22 UTC 2024","Fri Feb 09 22:35:32 UTC 2024","10320","Smoke tests","","","","","should create MongoDB database and three collections via API","This test checks MongoDB database and three collections creation"
"failed","Fri Feb 09 22:35:22 UTC 2024","Fri Feb 09 22:35:32 UTC 2024","10318","Smoke tests","","","","","should create MongoDB database and three collections via API","This test checks MongoDB database and three collections creation"
"failed","Fri Feb 09 22:35:22 UTC 2024","Fri Feb 09 22:35:32 UTC 2024","10231","Full regression","","","","","should create MongoDB database and collection via direct sending event to Kafka","This test checks MongoDB database and collection creation"
"failed","Fri Feb 09 22:35:22 UTC 2024","Fri Feb 09 22:35:32 UTC 2024","10225","Full regression","","","","","should create MongoDB database and collection via API","This test checks MongoDB database and collection creation"
"failed","Fri Feb 09 22:35:22 UTC 2024","Fri Feb 09 22:35:32 UTC 2024","10321","Full regression","","","","","Summarize Monthly Usage Data: Adding data to MongoDB collections","This test checks adding data to MongoDB collections"
